{"correction_id":"COR-EXAMPLE-001","finding_id":"PPR-FND-EXAMPLE-001","location":"p.12 para 2","current_text_or_object":"The results support stated limitation.","replacement_text_or_object":"The results support the stated limitation.","reason":"typesetter_error","submitted_by":"proof editor","submitted_at":"2026-08-14T00:00:00Z","decision":"accept","decision_owner":"production owner","decision_rationale":"Restores approved baseline.","incorporated_in":"proof-v2","reproof_scope":"p.12 and affected page flow","reproof_result":"passed"}
